500450-500477 sdcard_spi: bit: "Start bit: 0"
500477-500504 sdcard_spi: bit: "Transmitter bit: 1"
500504-500668 sdcard_spi: bit: "Command: CMD24 (WRITE_BLOCK)"
500671-501552 sdcard_spi: bit: "Argument: 0x04d2"
501555-501747 sdcard_spi: bit: "CRC7: 0x43"
501747-501775 sdcard_spi: bit: "End bit: 1"
500450-501775 sdcard_spi: cmd24: "CMD24 (WRITE_BLOCK): Write a block to address 0x04d2"
501998-502216 sdcard_spi: r1: "R1: 0x00"
502189-502216 sdcard_spi: bit: "Card is not in idle state"
502162-502189 sdcard_spi: bit: "Erase sequence not cleared"
502135-502162 sdcard_spi: bit: "No illegal command detected"
502107-502135 sdcard_spi: bit: "CRC check of last command was successful"
502080-502107 sdcard_spi: bit: "No error in the sequence of erase commands"
502053-502080 sdcard_spi: bit: "No misaligned address used in command"
502025-502053 sdcard_spi: bit: "Command argument not outside allowed range"
501998-502025 sdcard_spi: bit: "Bit 7 (always 0)"
502221-502441 sdcard_spi: cmd24: "Start Block"
502446-615937 sdcard_spi: cmd24: "Block data: [123, 123, 123, 123, 123, 123, 123, 123, 123, 123, 123, 123, 123, 123, 123, 123, 123, 123, 123, 123, 123, 123, 123, 123, 123, 123, 123, 123, 123, 123, 123, 123, 123, 123, 123, 123, 123, 123, 123, 123, 123, 123, 123, 123, 123, 123, 123, 123, 123, 123, 123, 123, 123, 123, 123, 123, 123, 123, 123, 123, 123, 123, 123, 123, 123, 123, 123, 123, 123, 123, 123, 123, 123, 123, 123, 123, 123, 123, 123, 123, 123, 123, 123, 123, 123, 123, 123, 123, 123, 123, 123, 123, 123, 123, 123, 123, 123, 123, 123, 123, 123, 123, 123, 123, 123, 123, 123, 123, 123, 123, 123, 123, 123, 123, 123, 123, 123, 123, 123, 123, 123, 123, 123, 123, 123, 123, 123, 123, 123, 123, 123, 123, 123, 123, 123, 123, 123, 123, 123, 123, 123, 123, 123, 123, 123, 123, 123, 123, 123, 123, 123, 123, 123, 123, 123, 123, 123, 123, 123, 123, 123, 123, 123, 123, 123, 123, 123, 123, 123, 123, 123, 123, 123, 123, 123, 123, 123, 123, 123, 123, 123, 123, 123, 123, 123, 123, 123, 123, 123, 123, 123, 123, 123, 123, 123, 123, 123, 123, 123, 123, 123, 123, 123, 123, 123, 123, 123, 123, 123, 123, 123, 123, 123, 123, 123, 123, 123, 123, 123, 123, 123, 123, 123, 123, 123, 123, 123, 123, 123, 123, 123, 123, 123, 123, 123, 123, 123, 123, 123, 123, 123, 123, 123, 123, 123, 123, 123, 123, 123, 123, 123, 123, 123, 123, 123, 123, 123, 123, 123, 123, 123, 123, 123, 123, 123, 123, 123, 123, 123, 123, 123, 123, 123, 123, 123, 123, 123, 123, 123, 123, 123, 123, 123, 123, 123, 123, 123, 123, 123, 123, 123, 123, 123, 123, 123, 123, 123, 123, 123, 123, 123, 123, 123, 123, 123, 123, 123, 123, 123, 123, 123, 123, 123, 123, 123, 123, 123, 123, 123, 123, 123, 123, 123, 123, 123, 123, 123, 123, 123, 123, 123, 123, 123, 123, 123, 123, 123, 123, 123, 123, 123, 123, 123, 123, 123, 123, 123, 123, 123, 123, 123, 123, 123, 123, 123, 123, 123, 123, 123, 123, 123, 123, 123, 123, 123, 123, 123, 123, 123, 123, 123, 123, 123, 123, 123, 123, 123, 123, 123, 123, 123, 123, 123, 123, 123, 123, 123, 123, 123, 123, 123, 123, 123, 123, 123, 123, 123, 123, 123, 123, 123, 123, 123, 123, 123, 123, 123, 123, 123, 123, 123, 123, 123, 123, 123, 123, 123, 123, 123, 123, 123, 123, 123, 123, 123, 123, 123, 123, 123, 123, 123, 123, 123, 123, 123, 123, 123, 123, 123, 123, 123, 123, 123, 123, 123, 123, 123, 123, 123, 123, 123, 123, 123, 123, 123, 123, 123, 123, 123, 123, 123, 123, 123, 123, 123, 123, 123, 123, 123, 123, 123, 123, 123, 123, 123, 123, 123, 123, 123, 123, 123, 123, 123, 123, 123, 123, 123, 123, 123, 123, 123, 123, 123, 123, 123, 123, 123, 123, 123, 123, 123, 123, 123, 123, 123, 123, 123, 123, 123, 123, 123, 123]"
616382-616464 sdcard_spi: bit: "Don't care"
616464-616491 sdcard_spi: bit: "Always 0"
616491-616573 sdcard_spi: bit: "Data accepted"
616573-616600 sdcard_spi: bit: "Always 1"
616382-616600 sdcard_spi: cmd24: "Data Response"
616606-651218 sdcard_spi: cmd24: "Card is busy"
20472385-20472412 sdcard_spi: bit: "Start bit: 0"
20472412-20472439 sdcard_spi: bit: "Transmitter bit: 1"
20472439-20472603 sdcard_spi: bit: "Command: CMD24 (WRITE_BLOCK)"
20472606-20473487 sdcard_spi: bit: "Argument: 0x04d2"
20473490-20473682 sdcard_spi: bit: "CRC7: 0x43"
20473682-20473710 sdcard_spi: bit: "End bit: 1"
20472385-20473710 sdcard_spi: cmd24: "CMD24 (WRITE_BLOCK): Write a block to address 0x04d2"
20473933-20474151 sdcard_spi: r1: "R1: 0x00"
20474124-20474151 sdcard_spi: bit: "Card is not in idle state"
20474097-20474124 sdcard_spi: bit: "Erase sequence not cleared"
20474070-20474097 sdcard_spi: bit: "No illegal command detected"
20474042-20474070 sdcard_spi: bit: "CRC check of last command was successful"
20474015-20474042 sdcard_spi: bit: "No error in the sequence of erase commands"
20473988-20474015 sdcard_spi: bit: "No misaligned address used in command"
20473960-20473988 sdcard_spi: bit: "Command argument not outside allowed range"
20473933-20473960 sdcard_spi: bit: "Bit 7 (always 0)"
20474156-20474376 sdcard_spi: cmd24: "Start Block"
20474381-20587872 sdcard_spi: cmd24: "Block data: [123, 123, 123, 123, 123, 123, 123, 123, 123, 123, 123, 123, 123, 123, 123, 123, 123, 123, 123, 123, 123, 123, 123, 123, 123, 123, 123, 123, 123, 123, 123, 123, 123, 123, 123, 123, 123, 123, 123, 123, 123, 123, 123, 123, 123, 123, 123, 123, 123, 123, 123, 123, 123, 123, 123, 123, 123, 123, 123, 123, 123, 123, 123, 123, 123, 123, 123, 123, 123, 123, 123, 123, 123, 123, 123, 123, 123, 123, 123, 123, 123, 123, 123, 123, 123, 123, 123, 123, 123, 123, 123, 123, 123, 123, 123, 123, 123, 123, 123, 123, 123, 123, 123, 123, 123, 123, 123, 123, 123, 123, 123, 123, 123, 123, 123, 123, 123, 123, 123, 123, 123, 123, 123, 123, 123, 123, 123, 123, 123, 123, 123, 123, 123, 123, 123, 123, 123, 123, 123, 123, 123, 123, 123, 123, 123, 123, 123, 123, 123, 123, 123, 123, 123, 123, 123, 123, 123, 123, 123, 123, 123, 123, 123, 123, 123, 123, 123, 123, 123, 123, 123, 123, 123, 123, 123, 123, 123, 123, 123, 123, 123, 123, 123, 123, 123, 123, 123, 123, 123, 123, 123, 123, 123, 123, 123, 123, 123, 123, 123, 123, 123, 123, 123, 123, 123, 123, 123, 123, 123, 123, 123, 123, 123, 123, 123, 123, 123, 123, 123, 123, 123, 123, 123, 123, 123, 123, 123, 123, 123, 123, 123, 123, 123, 123, 123, 123, 123, 123, 123, 123, 123, 123, 123, 123, 123, 123, 123, 123, 123, 123, 123, 123, 123, 123, 123, 123, 123, 123, 123, 123, 123, 123, 123, 123, 123, 123, 123, 123, 123, 123, 123, 123, 123, 123, 123, 123, 123, 123, 123, 123, 123, 123, 123, 123, 123, 123, 123, 123, 123, 123, 123, 123, 123, 123, 123, 123, 123, 123, 123, 123, 123, 123, 123, 123, 123, 123, 123, 123, 123, 123, 123, 123, 123, 123, 123, 123, 123, 123, 123, 123, 123, 123, 123, 123, 123, 123, 123, 123, 123, 123, 123, 123, 123, 123, 123, 123, 123, 123, 123, 123, 123, 123, 123, 123, 123, 123, 123, 123, 123, 123, 123, 123, 123, 123, 123, 123, 123, 123, 123, 123, 123, 123, 123, 123, 123, 123, 123, 123, 123, 123, 123, 123, 123, 123, 123, 123, 123, 123, 123, 123, 123, 123, 123, 123, 123, 123, 123, 123, 123, 123, 123, 123, 123, 123, 123, 123, 123, 123, 123, 123, 123, 123, 123, 123, 123, 123, 123, 123, 123, 123, 123, 123, 123, 123, 123, 123, 123, 123, 123, 123, 123, 123, 123, 123, 123, 123, 123, 123, 123, 123, 123, 123, 123, 123, 123, 123, 123, 123, 123, 123, 123, 123, 123, 123, 123, 123, 123, 123, 123, 123, 123, 123, 123, 123, 123, 123, 123, 123, 123, 123, 123, 123, 123, 123, 123, 123, 123, 123, 123, 123, 123, 123, 123, 123, 123, 123, 123, 123, 123, 123, 123, 123, 123, 123, 123, 123, 123, 123, 123, 123, 123, 123, 123, 123, 123, 123, 123, 123, 123, 123, 123, 123, 123, 123, 123, 123, 123, 123, 123, 123, 123, 123]"
20588317-20588399 sdcard_spi: bit: "Don't care"
20588399-20588426 sdcard_spi: bit: "Always 0"
20588426-20588508 sdcard_spi: bit: "Data accepted"
20588508-20588535 sdcard_spi: bit: "Always 1"
20588317-20588535 sdcard_spi: cmd24: "Data Response"
20588541-20622929 sdcard_spi: cmd24: "Card is busy"
